Seniority,Function,Subject Line,Hook 1,Z_Contact Status,Email Opened,Email Replied
Vp,Supply Chain,Your 22 years with Coke,"Going down the LinkedIn rabbit hole, I stumbled into your profile and am so impressed by your 22 years with the Coca Cola Company- your work in supply chain operations is os impressive and I'd love to connect.",Unresponsive,6/14/2022,
Manager,Logistics,Your expertise in transportation,"Given your expertise in transportation management, I'd be thrilled to connect and hear your insight on my company as we plan our next steps forward.",Interested,7/29/2022,6/7/2022
Director,Supply Chain,Your leadership in IT for Logistics,"Like you, I intend to be a leader in IT for supply chain and logistics, and I'd be delighted to connect. Considering your years of experience in the field, I'd value your opinion.",Attempting To Contact,5/26/2022,
Director,Logistics,Your expertise in corporate logistics,I'd be grateful for an opportunity to hear your perspective on a platform I've been working on. I believe I could learn from your expertise in corporate logistics.,Attempting To Contact,5/26/2022,
Vp,Supply Chain,Your 26 year tenure,"Looking through the Benjamin Moore team on LinkedIn, your profile really stood out because of your 26 year tenure there. More than that, your accomplishments in that time are astounding and I'd love to connect.",Unresponsive,6/7/2022,
Director,Supply Chain,Your 10 year tenure,"Scrolling through the Carlisle Interconnect Technologies team on LinkedIn, your profile really stood out, not only because of your 10 year tenure there, but because of your accomplishments in that time. I'd love the opportunity to connect.",Unresponsive,6/7/2022,
Manager,Logistics,Your labor management insight,"Caught your article, ""Crocs And Manhattan Find The Perfect Fit,"" and would love to hear more of your insight on labor management.",Unresponsive,,
Vp,Supply Chain,Your experience- supply chain,"Like you, I intend to be a leader in the ever-changing world of global supply chain ops, and I'd be delighted to connect. Considering your years of experience in the field, I'd value your opinion.",Unresponsive,,
Director,Supply Chain,Your opinion is needed,"Like you, I intend to be a leader in the ever-changing world of global supply chain ops, and I'd be delighted to connect. Considering your years of experience in the field, I'd value your opinion.",Unresponsive,,
Vp,Supply Chain,Your feature- Drinking Water Month,"Saw your feature in the article, ""Culligan International Celebrates National Drinking Water Month,"" and felt compelled to reach out. Your point that this is the perfect time to educate consumers on the safety of drinking water was excellent and I'd love to connect.",Unresponsive,5/30/2022,
Director,Logistics,Rebrand and Logistics,"Just read an article, ""FTD Unveils Full Creative Rebrand Focused on More Meaningful Giving,"" which led me to look up the team. Your years of expertise in logistics are what compelled me to reach out.",Interested,7/25/2022,6/30/2022
Director,Supply Chain,Your Penn State Master's,A Master's Degree from Penn State and an incredible career in Supply Chain Management- I can't think of a better person to connect with.,Interested,7/25/2022,6/14/2022
Vp,Supply Chain,Your feature- Safety and Mental Health,"Caught your feature in the article, ""SPX FLOW Launches New Initiative to Focus on Safety and Mental Health,"" and really liked your point that stress can lead to a lack of focus and it is a priority of SPX FLOW to ensure team members feel supported.",Unresponsive,,
Director,Logistics,Your 20 years at TPI Composites,"Scrolling through the TPI Composites team on LinkedIn, your profile really stood out not only because of your incredible 20 year career there, but also because of your accomplishments in that time- going from Design Engineer to Senior Director of Engineering.",Unresponsive,8/1/2022,
Director,Logistics,Leadership in Transportation,"Like you, I intend to be a leader in the ever-changing world of global transportation ops, and I'd be delighted to connect. Considering your years of experience in the field, I'd value your opinion.",Attempting To Contact,7/18/2022,
Manager,Logistics,Your knowledge- transportation management,I'd be grateful for an opportunity to hear your perspective on a platform I've been working on. I believe I could learn from your knowledge of transportation and logistics management.,Unresponsive,,
Vp,Logistics,Pleased to connect,"You appear to have mastered the field of logistics and supply chain management, and I'd be pleased to connect. I'd love to hear your insight on my company as we plan our next steps forward.",Unresponsive,6/3/2022,
Vp,Supply Chain,Your Leadership Style,"Like you, I intend to be a leader in the ever-changing world of global supply chain ops, and I'd be delighted to connect. Considering your years of experience in the field, I'd value your opinion.",Unresponsive,6/17/2022,
Manager,Supply Chain,Your leadership in logistics,Was looking through your LinkedIn and your endorsements really stood out. They speak to your leadership and expertise in logistics.,Not Interested,6/7/2022,6/7/2022
Director,Supply Chain,Your MBA from SMU,An MBA from SMU and an incredible career in supply chain operations- I can't think of a better person to reach out to. I'd be so thrilled to connect and hear your perspective on my company as we plan our next steps forward.,Attempting To Contact,6/3/2022,
Director,Logistics,Your 18 year tenure,"Scrolling through the MTD Products team on LinkedIn, I was completely floored by your tenure there. Your progression over the last 18 years from Logistics Manager to Director of Global Logistics is so impressive, and I'd love to connect.",Unresponsive,5/30/2022,
Director,Logistics,Founder Gathering Feedback,"Although I'll, unfortunately, most likely be lumped into the masses of ""outsourced engineering teams or solutions"" that clog your inbox, I am not trying to sell you on anything.  I'm attempting to gather feedback on a project I've been working on and would genuinely value your input.",Unresponsive,6/17/2022,
Director,Supply Chain,Your expertise in global supply chain,"Given your expertise in global supply chain operations, I'd be thrilled to have an opportunity to connect. I believe I could learn from your experience, and would truly appreciate your insight.",Unresponsive,5/26/2022,
Vp,Supply Chain,Your career at Crestron Electronics,"Looking through the Crestron Electronics team on LinkedIn, your profile really stood out because of your incredible career there- from Program Manager of Contract Manufacturing to VP of Supply Chain, your progression has been astounding.",Interested,7/29/2022,5/31/2022
Vp,Logistics,Your logistics expertise,I'd be grateful for an opportunity to hear your perspective on a platform I've been working on. I believe I could learn from your deep understanding of distribution and logistics.,Unresponsive,6/4/2022,
Manager,Supply Chain,Your endorsements,Was looking through your LinkedIn and your endorsements really stood out. They speak to your leadership and expertise in SAP.,Unresponsive,7/12/2022,
Director,Supply Chain,Supply Chain Team,"Just saw your feature in the article, ""Supply Chain Team Carries Nordson Through Challenging Times,"" and really liked your point that man-power is lacking in production facilities.",Attempting To Contact,,
Vp,Logistics,Your leadership in inventory control,Was looking through your LinkedIn and your endorsements really stood out. They speak to your leadership and expertise in inventory control and operations management.,Unresponsive,5/30/2022,
Vp,Supply Chain,"Your ""Growth- Oriented Mentorship""","Scrolling through the PGT Innovations team on LinkedIn, your profile really stood out because of your leadership style- specifically your commitment to employee engagement and development and ""growth- oriented mentorship.""",Unresponsive,,
Vp,Supply Chain,Your tenure at Quanex,"Looking through the Quanex Building Products Corporation Team on LinkedIn, your profile really stood out because of your tenure there, as well as the sheer amount that you have been able to accomplish over the last 17 years. Kudos!",Unresponsive,6/4/2022,
Head,Supply Chain,Your insight and planning,"Given your expertise in supply chain management and optimization, you'd be the perfect person to speak with. I'd be thrilled to have an opportunity to connect and hear your insight on my company as we plan our next steps forward.",Unresponsive,,
Vp,Supply Chain,Shiloh Industries' Carbon Footprint,"Saw your feature in the article, ""Shiloh Industries Reaches New Sustainability Milestone"" from back in 2020 and really liked your point that you're aligning yourselves with partners focused on reducing their carbon footprint- excellent work!",Unresponsive,6/16/2022,
Vp,Supply Chain,New facility in GA,"Caught your feature in the article, ""Hillman Group plans new multi-use facility in Georgia.""- very exciting news.",Unresponsive,,
Director,Logistics,Supply chain expert,"You seem to be an expert in supply chain management, and I'd really appreciate your insight on a project of mine.",Hot on the Hook,6/17/2022,6/14/2022
Vp,Supply Chain,Your feature- ACS adopting programs,"Saw your feature in the article, ""ACS Industries, Inc. Adopts TrueCommerce Supplier Enablement and EDI Solutions,"" and felt compelled to reach out. I'd love to hear more on its assistance in optimizing B2B distribution programs.",Interested,7/29/2022,6/6/2022
Director,Logistics,Your promotion- congrats,"Congratulations on your promotion to Director of Logistics and Distribution at Firestone Building Products- such exciting news and so well-deserved, given your incredible work as Manager of Logistics and Distribution over the past 6 years.",Unresponsive,6/17/2022,
Director,Supply Chain,Your leadership- Supply Chain,"Like you, I intend to be a leader in the ever-changing world of global supply chain ops, and I'd be delighted to connect. Considering your years of experience in the field, I'd value your opinion.",Unresponsive,6/22/2022,
Director,Logistics,Your expertise in transportation mgmt,"Given your expertise in transportation and logistics management, I'd be thrilled to have an opportunity to hear your insight on my company as we plan our next steps forward.",Attempting To Contact,5/26/2022,
Manager,Logistics,New Position ??,Congratulations on your new role as Senior Manager of Transportation Operations at Clorox- such exciting news.,Unresponsive,7/18/2022,
Head,Supply Chain,Supply Chain Head,"Given your new position as Supply Chain Head at Clorox and your incredible expertise in the field, I'd be so grateful for an opportunity to hear your industry insight.",Unresponsive,,
Vp,Supply Chain,Pleased to Connect,You appear to have mastered the field of supply chain and I'd be pleased to connect. You strike me as an ideal professional to exchange ideas with.,Unresponsive,,
Manager,Supply Chain,17 Years @ Clorox,17 years at Clorox- Incredible! Your years of experience in supply chain make your insight so valuable- I'd love to hear your thoughts on a project of mine.,Attempting To Contact,,
Director,Supply Chain,27 Years at Clorox,Completely floored by your 27 years at Clorox- incredible! I'd be so thrilled to have an opportunity to hear your valuable supply chain insight as my company plans our next steps forward.,Unresponsive,7/26/2022,
Manager,Supply Chain,Supply Chain Expert,"Know this is a long shot, but I'm looking to connect with supply chain and logistics experts for feedback on my new platform. Came across your profile while down a rabbit hole last night and felt compelled to reach out.",Unresponsive,7/20/2022,
Manager,Supply Chain,Supply Chain at Clorox,"Completely floored by your expertise in supply chain at Clorox, I'd love to hear your industry insight.",Unresponsive,7/20/2022,
Director,Logistics,Transport Ops,"Given your new position as Director of Global Transportation at Clorox, and your incredible experience in transportation operations, I'd be so thrilled to have an opportunity to connect.",Unresponsive,7/20/2022,
Manager,Supply Chain,36 Years at Clorox,"Your 36 years of experience at Clorox is incredible, and must lead to incredible industry insight. I'd be so thrilled to have an opportunity to connect.",Unresponsive,7/20/2022,
Manager,Supply Chain,Supply Chain Expert,You appear to have mastered the field of supply chain management and I'd be pleased to connect. You strike me as an ideal professional to exchange ideas with.,Attempting To Contact,,
Director,Supply Chain,Supply Chain Finance,"Your expertise in supply chain finance is incredible, and I'd love to hear your industry insight.",Unresponsive,,
Manager,Supply Chain,Expert Feedback,"Know this is a long shot, but I'm looking to connect with supply chain and logistics experts for feedback on my new platform. Came across your profile while down a rabbit hole last night and felt compelled to reach out.",Unresponsive,,
Vp,Supply Chain,25+ Year Career,Your 25+ year career in supply chain is commendable and I'd be so grateful for an opportunity to hear your expert insight on my company as we plan next steps.,Unresponsive,,
Director,Logistics,Congratulations,Congratulations on your new position as Vice President of Logistics at Centric Brands- very exciting news.,Attempting To Contact,,
Vp,Supply Chain,Your MBA,A University of Wisconsin MBA and an incredible career in supply chain finance- Wow. I can't think of a better person to reach out to.,Unresponsive,7/20/2022,
Manager,Logistics,Tristar Products Acquisition,"Just saw an article on Spectrum Brands' acquisition of Tristar Products’ kitchen appliances and cookware business, and found myself wondering how this would affect the companies' transportation logistics- who better to ask than you?",Unresponsive,,
Director,Supply Chain,UC Irvine MBA,"A University of California, Irvine MBA and an incredible career in supply chain operations- I can't think of a better person to reach out to.",Attempting To Contact,,
Manager,Transportation,Your New Role,Congratulations on your new position as Senior Project Manager - Logistics and Transportation for Spectrum Brands- very exciting news.,Unresponsive,,
Vp,Transportation,Jerry Cederlund Recommendation,"Scrolling through your LinkedIn profile, Jerry's recommendation really stood out- ""Mike builds strong diverse teams, understands and develops company strategies and gets the job done."" Awesome.",Unresponsive,7/22/2022,
Director,Supply Chain,Years of Supply Chain,"Given your years of experience in supply chain operations, I'd love to hear your insight on a project of mine.",Attempting To Contact,,
Manager,Logistics,Perpective on Transport,I'd be grateful for an opportunity to hear your perspective on a platform I've been working on. I believe I could learn from your expertise in transportation logistics.,Unresponsive,7/20/2022,
Director,Logistics,Leadership in Logistics Ops,You strike me as a man that has spent significant amounts of time contemplating the concept of 'leadership' in logistics operations - I'd value your evaluation on a potential solution I've been working on to assist the thought process.,Unresponsive,7/23/2022,
Head,Supply Chain,Logistics Rabbit Hole,"Know this is a long shot, but I'm looking to connect with supply chain and logistics experts for feedback on my new platform. Came across your profile while down a rabbit hole last night and felt compelled to reach out.",Unresponsive,,
Manager,Logistics,Your Tagline,"Was scrolling through your LinkedIn bio and loved your tagline- that you ""thrive in leading diverse teams and providing innovative, collaborative solutions to complex issues.""",Unresponsive,,
Director,Supply Chain,Your New Role,Congratulations on your new role as Sr. Director - Global Supply Chain Risk Management for McCormick- very exciting news.,Unresponsive,7/22/2022,
Director,Logistics,Supply Chain Strategies,"One line in your LinkedIn bio really stood out- "" I have demonstrated success in the areas of developing supply chain strategies and contract negotiations that deliver competitive cost advantages."" I'd love to connect and discuss.",Not Interested,7/26/2022,7/22/2022
Manager,Supply Chain,Skilled and Thorough,"Going down the LinkedIn rabbit hole, one line from your bio really stood out- that you're ""Skilled and thorough in analyzing problem situations and finding creative Supply Chain solutions."" I'd be so thrilled to hear your industry insight.",Attempting To Contact,6/28/2022,
Partner,Logistics,Supply Chain Expert,"Going down the LinkedIn rabbit hole, your 25 years of supply chain expertise stood out- I'm looking for supply chain experts like yourself to connect with, to test a few theories.",Unresponsive,7/1/2022,
Partner,Logistics,Smithfield Foods and Ferrara,"Looking for logistics experts to reach out to, I came across your profile and am completely floored by your experience at Smithfield Foods and Ferrara.",Attempting To Contact,6/28/2022,
Director,Logistics,Logistics expertise ??,"Given your years of logistics experience, I'd be thrilled to have an opportunity to connect.",Unresponsive,,
Director,Supply Chain,Your thoughts on Leadership,You strike me as a man that has spent significant amounts of time contemplating the concept of 'leadership' in your role as Director of Supply Chain at Ferrara- I'd value your evaluation on a potential solution I've been working on to assist the thought process.,Unresponsive,6/23/2022,
Director,Supply Chain,Qazzafi Pothiawala Recommendation,"Reading through your LinkedIn recommendations, the one from Qazzafi Pothiawala really stood out, saying that you have an ""eye on key details and great focus on the big picture.""- Fantastic.",Unresponsive,,
Manager,Logistics,Transportation & Logistics,"You appear to have mastered the fields of supply chain, transportation, and logistics, and I'd be pleased to connect.",Unresponsive,7/1/2022,
Director,Logistics,Reynolds transportation,Saw that you're the Director of Transportation for Reynolds- I'd love to have an opportunity to connect with you and pick your brain about a project of mine.,Unresponsive,6/18/2022,
Manager,Supply Chain,Congrats on your new role,"Congratulations on your new position as Senior Manager of Global Supply Chain for Reynolds- such exciting news and so well-deserved, given your incredible work over the last 22 years at Molex.",Attempting To Contact,,
Manager,Logistics,41 years with Reynolds,"Scrolling through the Reynolds team on LinkedIn, your profile really stood out because of your 41 years there- incredible! I'd be so thrilled to have an opportunity to hear your transportation industry insight.",Attempting To Contact,6/22/2022,
Director,Supply Chain,California State MBA,A California State MBA and an awesome career in supply chain for E.J.Gallo- I can't think of a better person to reach out to.,Unresponsive,7/26/2022,
Director,Supply Chain,Supply Chain Logistics,"Your expertise in supply chain logistics is incredible, and I'd love to pick your brain about a project of mine. Your insight would be so valuable.",Unresponsive,7/27/2022,
Director,Supply Chain,Industry Insight,"Given your extensive expertise in supply chain management, I'd love to connect and hear your industry insight as my company plans our next steps forward.",Unresponsive,,
Manager,Logistics,Congrats- your new role,"Congratulations on your new position as Senior Director of Domestic Logistics for GE Appliances- such exciting news and so well-deserved, given your incredible work at Transplace over the past three years.",Unresponsive,6/20/2022,
Director,Logistics,New(ish) role- congrats!,"Congratulations on your new position as Director of Transportation at GE Appliances- such exciting news and so well-deserved, given your incredible work as Senior Ops Manager.",Unresponsive,6/22/2022,
Director,Logistics,Director of Logistics,"Congrats on your (fairly) recent return to the Scotts Miracle Gro company as Director of Logistics- such exciting news and so well-deserved, given your experience there and at The Hawthorne Gardening Company.",Unresponsive,6/17/2022,
Director,Supply Chain,Your New Role ??,"Congratulations on your new position as supply chain director for Scotts Miracle Gro. Very exciting news and so well-deserved, given your experience as national account manager.",Unresponsive,6/17/2022,
Manager,Supply Chain,15 Years at Kohler,"Your 15 years at Kohler is commendable, and must lead to incredible industry insight. I'd be so grateful to hear your expertise in supply chain operations.",Unresponsive,7/24/2022,
Director,Supply Chain,Supply Chain Endorsements,Was looking through your LinkedIn and your endorsements really stood out. They speak to your leadership and expertise in logistics and supply chain operations.,Unresponsive,7/20/2022,
Manager,Supply Chain,Schreiber Foods to Kohler,"From Schreiber Foods to Kohler, your career progression and ability to climb the ladder in supply chain operations has been commendable, and I'd be so grateful for an opportunity to chat with you.",Unresponsive,7/20/2022,
Director,Supply Chain,17 Years at Kohler,"17 Years in supply chain at Kohler is incredible, and must lead to incredible industry insight. I'd be so grateful for an opportunity to connect.",Unresponsive,7/14/2022,
Manager,Supply Chain,Rick Allen Recommendation,"Scrolling through your LinkedIn bio, Rick's recommendation really stood out- ""He spent the time to pass his knowledge and allowed them to create processes without repercussions if not perfect.""- Fantastic!",Unresponsive,7/23/2022,
Director,Supply Chain,Founder Seeking Perspective,I'd be grateful for an opportunity to hear your perspective on a platform I've been working on. I believe I could learn from your deep understanding of supply chain management.,Attempting To Contact,6/22/2022,
Director,Supply Chain,Distribution & Supply Chain,"Like you, I intend to be a leader in the ever-changing world of global supply chain ops, and I'd be delighted to connect. Considering your years of experience in the field, I'd value your opinion.",Unresponsive,,
Director,Supply Chain,Supply Chain and Ops,I'd be grateful for an opportunity to hear your perspective on a platform I've been working on. I believe I could learn from your expertise in supply chain strategy and operations.,Unresponsive,6/14/2022,
Director,Logistics,Impressive Expertise,"Your expertise in eCommerce logistics is so impressive, and I'd be delighted to hear your insight on a project of mine. ",Unresponsive,,
Director,Logistics,University of St. Thomas MBA,An MBA focused in logistics and an incredible career in the field-- I'd be so thrilled to pick your brain for industry insight.,Attempting To Contact,,
Director,Supply Chain,32 Years at Hasbro,"Your 32 years at Hasbro is astonishing, and I'm sure your expertise and industry insight are off the charts. I'd love to hear your thoughts on my company as we plan our next steps.",Attempting To Contact,,
Vp,Logistics,Your New Role,Congratulations on your new position as Vice President- Global Inbound Logistics for Hasbro- very exciting news.,Attempting To Contact,8/19/2022,
Manager,Logistics,Logistics at Hasbro,"Given your incredible experience in logistics for Hasbro, I'd love to hear your industry insight as my company plans our next steps. Your input would be so valuable.",Unresponsive,,
Director,Logistics,Leadership in Logistics,Was looking through your LinkedIn and your endorsements really stood out. They speak to your leadership and expertise in logistics and supply chain management.,Unresponsive,7/20/2022,
Vp,Supply Chain,Logistics Expert,"Know this is a long shot, but I'm looking to connect with supply chain and logistics experts for feedback on my new platform. Came across your profile and felt compelled to reach out.",Unresponsive,7/20/2022,
Director,Logistics,Fifteen Years,"With over fifteen years of experience in Procurement and Supply Chain Management, I can't think of a better person to reach out to- I'd love to hear your perspective on a project of mine.",Attempting To Contact,7/22/2022,
Director,Logistics,A year in your position,"Coming up on a year as senior director of logistics, your insight would be so valuable to my company as we plan next steps.",Unresponsive,7/26/2022,
Director,Logistics,Long Shot Logistics,"Know this is a long shot, but in looking for Logistics professionals to connect with, your profile really stood out- I'd love to hear more about your experience with Hasbro.",Unresponsive,7/23/2022,
Director,Logistics,Nexeo Plastics to J.R.Simplot,"Going from Nexeo Plastics to J.R.Simplot, I'd love to hear your experience. Given your expertise, your insight would be so valuable as my company plans next steps.",Attempting To Contact,7/14/2022,
Manager,Logistics,Your New(ish) Role,Congratulations on your (relatively) new position as Senior International Logistics Manager- very exciting news.,Attempting To Contact,,
Director,Supply Chain,Your New(ish) Role,"Congratulations on your (relatively) new position as Business Partnering Director - Manufacturing and Supply Chain Finance at J.R. Simplot.- Very exciting news and so well-deserved, given your 18 years of incredible work with the company.",Unresponsive,,
Director,Logistics,34 Years @ J.R.Simplot,"34 years with J. R. Simplot is incredible! Your insight would be so valuable, and I'd love to hear your perspective on my company as we plan next steps.",Unresponsive,,
Director,Supply Chain,Compelled to Reach Out,"Know this is a long shot, but I'm looking to connect with supply chain and logistics experts for feedback on my new platform. Came across your profile and felt compelled to reach out.",Unresponsive,,
Vp,Supply Chain,Well-Rounded,"Having worked in large, publicly traded companies as well as startups, your expertise is incredibly well-rounded, and I'd love to hear more of your experience.",Unresponsive,7/26/2022,
